<?xml version="1.0" encoding="UTF-8" standalone="yes"?>
<!DOCTYPE recetario SYSTEM "DTD.dtd">
<recetario>
    <receta dificultad="facil" tipo="mediterranea">
        <nombreReceta>Ensalada de maiz</nombreReceta>
        <ingredientes>
            <ingrediente>
                <nombreIngrediente>Maiz</nombreIngrediente>
                <cantidad>0</cantidad>
            </ingrediente>
        </ingredientes>
        <instrucciones>Cocinar el maiz</instrucciones>
    </receta>
</recetario>
