<?xml version="1.0" encoding="UTF-8"?>
<!DOCTYPE recetario SYSTEM "DTD.dtd">
<recetario>
    <receta dificultad="fácil" tipo="mediterranea">
        <nombreReceta>Ensalada de maiz</nombreReceta>
        <ingredientes>
            <ingrediente>
                <nombreIngrediente>Maizz</nombreIngrediente>
                <cantidad>0</cantidad>
            </ingrediente>
        </ingredientes>
        <instrucciones>Cocinar el maiz</instrucciones>
    </receta>
    <receta dificultad="media" tipo="Arabe">
        <nombreReceta>Ensalada de puerro</nombreReceta>
        <ingredientes>
            <ingrediente>
                <nombreIngrediente>puerro</nombreIngrediente>
                <cantidad>2</cantidad>
            </ingrediente>
        </ingredientes>
        <instrucciones>Cocinar el puerro</instrucciones>
    </receta>
    <receta dificultad="" tipo="fácil arabe">
        <nombreReceta>cuscus</nombreReceta>
        <ingredientes>
            <ingrediente>
                <nombreIngrediente></nombreIngrediente>
                <cantidad>manzana</cantidad>
            </ingrediente>
            <ingrediente>
                <nombreIngrediente></nombreIngrediente>
                <cantidad>manzana</cantidad>
            </ingrediente>
        </ingredientes>
        <instrucciones></instrucciones>
    </receta>
    <receta dificultad="fácil" tipo="asturiana">
        <nombreReceta>Fabada</nombreReceta>
        <ingredientes>
            <ingrediente>
                <nombreIngrediente>Chorizo</nombreIngrediente>
                <cantidad>100 gramos</cantidad>
            </ingrediente>
            <ingrediente>
                <nombreIngrediente>Chorizo</nombreIngrediente>
                <cantidad>100 gramos</cantidad>
            </ingrediente>
        </ingredientes>
        <instrucciones>Hay que cocer las judias y luego juntarlas con chorizo</instrucciones>
    </receta>
</recetario>